"","auteurs.0.prenom","date_soutenance","directeurs_these.0.prenom","president_jury.prenom","titres.fr"
"942","Eva",2003-01-01,"Pierre",NA,"Étude comparative de trois pratiques corporelles : l'aérobic, le surf des neiges, et le tennis : comparaison interculturelle entre pratiquants de Paris et de Barcelone"
"943","João Sousa",2009-01-01,"Michel",NA,"L'imaginaire de la communauté portugaise en France, à travers les images en mouvement (1967-2007)"
"944","Wai-Ting",2005-01-01,"Michel","Jean","Sociologie de la folie : effervescence religieuse et société moderne de Taiwan"
"945","Anne-Claire",2009-01-01,"Dominique","Olivier","Analyse de la construction sociale de la notion de ""jeu pathologique"" et de ses effets sur les représentations et pratiques des joueurs de la Française des Jeux"
"946","Arezki",2007-01-01,"Anne-Marie","Michel","Les dynamiques de recomposition des professions du social"
"947","Sachié",2010-01-01,"Anne-Marie","Anne-Marie","Le vieillissement rural revisité : l'approche par les capabilités en action"
"948","Junko",2006-01-01,"Bernard",NA,"Urbanisme et centralité, le cas de Tokyo"
"949","Alice",2009-01-01,"Jan",NA,"Les visions du monde des dirigeants associatifs de protection de la nature : entre quêtes de sens et rationalité d'actions"
"950","Federico",2000-01-01,"Michel",NA,"Les cybersocialites : nouvelles formes d'interaction communautaire"
"951","Orphée Martial",2011-01-01,"Jean",NA,"Le jeu et les enjeux de l'engagement associatif et syndical des jeunes au Gabon : étude entre expérimentations et constructions identitaires des étudiants de l'université Omar Bongo de Libreville (1972 à 2006)"
"952","Maëlle",2010-01-01,"Laurence","Olivier","De la rue au foyer : une analyse sociologique des trajectoires de mères sans logement personnel"
"953","Aimé",2007-01-01,"Jean","Catherine","Le syndicalisme des enseignants du secteur public au Gabon, de 1990 à nos jours : contribution au fondement d'une sociologie du pouvoir au Gabon"
"954","Christophe",2001-01-01,"François de",NA,"Chambres d'hôtes à la ferme et autonomie de la femme en agriculture"
"955","Arnaud",2008-01-01,"Jan",NA,"Sexualité et prison : enjeux de punition, enjeux de réinsertion"
"956","Francesca",2010-01-01,"Antigone",NA,"L'enfant, un public spécifique : l'éducation muséale : étude comparative France-Italie"
"957","Juan",2003-01-01,"Yves",NA,"L'école et les inégalités en Amérique latine"
"958","Isabelle",2008-01-01,"Alain",NA,"L'adolescence au prisme de la santé mentale : la recomposition des modes d'action en psychiatrie infanto-juvénile de secteur"
"959","Hang-sub",2000-01-01,"Michel",NA,"Analyse de la distinction sociale : la coexistence de la distinction et de la non-distinction dans la societe coreenne"
"960","Lucas",2009-01-01,"Yves",NA,"Les jeunes Camerounais et le sida : sociologie d'une non-protection face à la maladie"
"961","Brigitte",2000-01-01,"Bernard",NA,"Roman du mythe et mythes du roman : recherche critique sur les catégories du mythique et du romanesque"
"962","Alexis",2009-01-01,"Michel",NA,"Le metal : un projet mythologique articulé au jeu et au don"
"963","Sarra",2007-01-01,"François de",NA,"La place des parents dans les services d'enfant : entre délégation, réappropriation et contrôle croisé des logiques de soins"
"964","Pascal Alain",2005-01-01,"Pierre","Bertrand","La motricité ludique d'une société africaine : analyse structurale des jeux traditionnels des peuples Ndzébi du Congo Brazzaville"
"965","Laïla",2008-01-01,"Monique",NA,"Le harcèlement moral au travail : analyse sociologique"
"966","Étienne",2005-01-01,"François de","Bernard","L'absentéisme scolaire : une étude sociologique"
"967","Emilie",2011-01-01,"Michel","Jean-Martin","Le mâle du siècle : mutation et renaissance des masculinités : archétypes, stéréotypes, et néotypes masculins dans les iconographies médiatiques"
"968","Marie-Paule",2000-01-01,"Pierre",NA,"Quelles pratiques corporelles au college ? l'eps sous l'angle de la sociologie des parcours scolaires"
"969","Sarah Reine",2011-01-01,"Antigone","Bernard","États‐Unis, musées et publics : l'exemple de l’Art Institute of Chicago"
"970","Chadia",2017-10-10,"Patrick","Johanna","Entre travail et engagement, les acteurs expatriés et nationaux de solidarité internationale au Maroc : volontaires, salariés, bénévoles et stagiaires. Le cosmopolitisme à l'épreuve ?"
"971","Erica",2011-01-01,"Michel","Jean-Martin","Santé et spiritisme : itinéraires thérapeutiques de la troisième révélation en France et au Brésil"
"972","Magdalena",2002-01-01,"Dominique",NA,"La sociabilité amicale nocturne comme espace de construction identitaire : étude comparative de jeunes adultes vivant à Stockholm et à Paris"
"973","Laurent",2002-01-01,"Jacques",NA,"L'ontogenèse du comportement alimentaire du primate Eulemur fulvus en forêt sèche (Mayotte, archipel des Comores) en relation avec le lien mère-jeune et la disponibilité des ressources alimentaires"
"974","Vincenzo",2007-01-01,"Michel",NA,"La récréation du monde : les médias et les dérives transpolitiques de l'imaginaire postmoderne"
"975","Constance",2018-01-09,"Bertrand","Séverine","La décision médicale dans le champ de l’Assistance Médicale à la Procréation : une étude sociologique sur les pratiques et les représentations des spécialistes de la reproduction"
"976","Lionel",2010-10-01,"Catherine","Philippe","Les collèges d’experts et la fabrique de la normalisation technique. Hybridation Normative et Performation de la Haute Qualité Environnementale (HQE) des Bâtiments en France."
"977","Julien",2010-06-02,"Alain","David","La France et les enfants d'immigrés : une ""crise du don"""
"978","Konan Jérôme",2009-06-30,"Claudine","N'Guessan François","Inscriptions administratives et réalités socioculturelles : une étude des représentations et pratiques d’état civil en Côte d’Ivoire"
"979","Isabelle",2009-01-01,"Philippe",NA,"Actions militantes et identités basques : trajectoires d'engagement, socialisations militantes et constructions identitaires dans les organisations nationalistes (et non-nationalistes) au Pays basque français"
"980","Shafagh",2013-11-29,"Sylvie","Jan","La construction identitaire en milieu plurilingue et pluriculturel : étude de la politique linguistique éducative des écoles européennes dans le contexte luxembourgeois"
"981","Jérémie",2014-01-01,"Charles",NA,"La pédagogie de la création : une sociologie de l'enseignement artistique"
"982","Emilie",2012-12-06,"Bruno","Catherine","Trajectoires professionnelles d’artistes plasticiens. Étude de cas comparative. Espace29, France – Wonderful District, Vietnam"
"983","Virginie",2014-09-30,"Bruno","Jean-Louis","""Challenge"" ou ""Ballet"". La formation de deux mondes professionnels de la danse hip hop"
"984","Felipe",2012-01-01,"Norbert",NA,"Dynamiques sociales et changement de pratiques viticoles : échanges professionnels, don et identités Le cas des viticulteurs de deux communes dans l’Hérault"
"985","Clément",2014-03-28,"Marco","Agnès","Ce que tous les parents disent ? : approche compréhensive de l’encadrement parental des pratiques urbaines des enfants en contexte de mixité sociale (Paris-Milan)"
"986","Quentin",2012-01-01,"Danièle",NA,"La stratégie de la bactérie : biographie sociale d’une marchandise médicale"
"987","Sbeih",2014-01-01,"Riccardo",NA,"La ""professionnalisation"" des ONG en Palestine : entre pression des bailleurs de fonds et logique d'engagement"
"988","Federico",2012-12-11,"Patrick","Christian","« Il faut faire le peuple ! » : sociologie d’un populisme « par le bas » dans les conseils de barrio en Amérique latine contemporaine (Venezuela et Bolivie)"
"989","Adèle",2016-11-04,"Stéphane","Emmanuelle","Les enfants d'immigrés au temps du droit à la différence : socio-histoire d'une politique compassionnelle"
"990","Olgu",2016-07-07,"Jean-François","Denise","Quels changements en cas de changement de la bureaucratie d'Etat ? : une analyse de la politique turque pendant les négociations du projet de corridor sud de l'énergie (SECP)"
"991","Alessandra",2011-01-01,"Shmuel",NA,"L'utopie du non genre : la Queer Theory à l’épreuve de la Res publica"
"992","Ronen",2014-06-16,"Shmuel","Georges-Elia","La sainteté collective dans la politique biblique : aux sources de la théologie politique"
"993","Hélène",2012-01-01,"Agnès",NA,"Ressources de la toile et ressources du réseau : les pratiques numériques de lycéens de quartiers populaires de Rio de Janeiro et de région parisienne"
"994","Maria-Rosaria",2014-12-10,"Bernard","Lionel","Réguler l’emploi, le salaire et le travail par le maintien du contrat de travail : le cas de la Cassa Integrazione Guadagni en Italie"
"995","Tahar",2012-01-01,"Norbert",NA,"Assignation collective et socialisation d'attente : le cas des harkis et des jeunes de cités"
"996","Guillaume",2012-09-21,"Philippe","Éric","Traitement social de la criminalité sexuelle pédophile : rapports de pouvoir et lutte des représentations entre agents chargés du contrôle et condamnés"
"997","Yasmine",2014-01-30,"Benoit",NA,"La parentalité sous le regard de la justice : étude comparée des espaces de rencontre en France et en Hongrie (2007-2011) à partir d'une conceptualisation sociologique du dispositif"
"998","Brice",2014-01-27,"Alain","François","Sociogénétique de la dollarisation : l’institution monétaire de la société canadienne, 1654 –1871"
"999","Ahmed",2016-02-11,"Jean-Paul","Johanna","Formes sociales d'agriculture irriguée en Méditerranée occidentale, expériences des risques et ""visions"" du monde : étude de cas dans la plaine de la Mitidja en Algérie et comparaison entre plusieurs territoires irrigués du Nord et du Sud de la Méditerranée occidentale"
"1000","Argán",2013-12-19,"María-Eugenia","Françoise","Migrations clandestines d'Amérique centrale vers les Etats-Unis : Actions en réseau et mobilité dans l'adversité en une ère de flux et de frontières."
"1001","Clélia",2014-12-12,"Bruno","Georges","Corps à l'oeuvre, à l'ouvrage et à l'épreuve : sociohistorique des arts de la performance, années 1970"
"1002","Théophane",2012-01-01,"Alia",NA,"La gestion des déchets solides ménagers : pratiques d’acteurs et inégalités socio-spatiales dans la ville de Porto-Novo (Bénin)"
"1003","Felipe",2014-09-19,"Christine","Jean-Philippe","Les universitaires britanniques face aux instruments d'évaluation et de financement de la recherche : les départements de géographie et d'informatique de deux universités face au Research Assessment Exercise et au full   Economic Costing en Grande Bretagne"
"1004","Estelle",2011-12-07,"Bruno",NA,"Paris 21ème siècle, capitale du monde des arts d'Afrique Noire : Le rôle de la scène artistique parisienne dans la construction de la valeur des Arts d’Afrique Noire"
"1005","Thomas",2013-12-03,"Pierre","Olivier","Sociologie des jeux de hasard. Croyances et rationalité"
"1006","Sabrina",2015-01-07,"Catherine","María-Eugenia","Choisir le « bon moment » pour partir à la retraite : analyse des décisions de fin de carrière des générations 1945-1950"
"1007","Laura",2014-03-21,"Bruno","Bernard","Les Cadiens au présent. Revendications identitaires d'une population francophone en situation minoritaire."
"1008","Julien",2011-01-01,"Danièle",NA,"Sociologie critique de l'innovation technologique : le cas de la télébillettique dans les transports publics parisiens"
"1009","Elise",2015-01-19,"Jean-Paul","David","Vers une recomposition des rapports entre sociétés et rivières : l’hydromorphologie des cours d’eau : processus, représentations et enjeux de gestion environnementale sur la Dordogne moyenne"
"1010","Aurélien",2012-06-20,"Bernard","François","Le financement des étudiants en France et en Angleterre de 1945 à 2011 : le student finance, l'award et le salaire étudiant et leur hégémonie."
"1011","Brigitte",2012-01-01,"Agnès",NA,"Les élites étudiantes internationales face au modèle d'excellence des Grandes Ecoles françaises"
"1012","Guillaume",2011-01-01,"Norbert",NA,"Autonomie individuelle et action collective : la mise en forme du lien social dans le parti des Verts"
"1013","Anne",2007-01-01,"Jacques",NA,"La cause des femmes dans l’État : une comparaison France-Québec (1965-2007)"
"1014","Mathieu",2016-06-03,"Patrick","Anne","Une politique du rap ? : prise de parole, pouvoir des mots et subversion"
"1015","Anne-Claire",2018-06-28,"Stéphane","Yves","Le moment français du postcolonial : pour une sociologie historique d’un débat intellectuel"
"1016","Olivier",2017-11-22,"Patrick","Christian","Sociologie de la ""Réussite éducative"" : un cas d'école des nouvelles politiques éducatives"
"1017","Claire",2018-07-03,"Stéphane","Laëtitia","Le petit monde du développement porté par les migrants : une sociologie de la reconnaissance des « associations de migrants » dans les arènes françaises de la coopération au développement (1981-2014)"
"1018","Estelle-Fleur",2013-11-29,"Dominique","Pierre","Les conditions sociales de l’adoption de comportements plus durables en matière de consommation et de gestion des déchets : analyse sociologique d’un dispositif de démocratie participative et des théories d’action en sciences humaines et sociales"
"1019","Frédérique",2010-12-13,"Anni","Daniel","Tiers en urgences. Les interactions de secours, de l’appel au 18 à l’accueil en service d’urgences pédiatriques. Contribution à une sociologie du tiers."
"1020","Julie",2017-10-19,"Olivier","Philippe","Gouverner par le temps : la gestion des déchets radioactifs en France, entre changements organisationnels et construction de solutions techniques irréversibles (1950-2014)"
"1021","Laura",2018-12-21,"Bruno","Olivier","L'art mural comme stratégie de survie des communautés rurales. Trois études de cas en milieu rural italien"
"1022","Florence",2018-03-14,"Valérie","Johanna","La marchandisation de l'engagement des jeunes : les ""dérives"" du service civique à la Ligue de l'enseignement"
"1023","Aurélien",2012-12-13,"Michel","Patrick","L'esprit du jeu dans les sociétés postmodernes : Anomies et socialités : Bovarysme, mémoire et aventure"
"1024","Jacob",2012-10-16,"Dominique","Dominique","La sélection sociale de l’innovation : Parcours d’innovations environnementales depuis un centre de Recherche & Développement jusqu’à l’espace domestique"
"1025","Pascal",2012-11-21,"Olivier","Michel","De « petits » employés d’un « grand » magasin : Enquête sur les employés de la vente au Bazar de l’Opéra"
"1026","Pauline",2012-11-19,"Olivier","Stéphane","La recomposition d’une aristocratie ouvrière : Enquête ethnographique aux chantiers navals de Saint-Nazaire"
"1027","Kamal",2000-01-01,"Pierre",NA,"Le narguilé : analyse socio-anthropologique : culture, convivialité, histoire et tabacologie d'un mode d'usage populaire du tabac"
"1028","Caroline",2000-01-01,"Michel",NA,"Les logiques d'apprentissage collectif en recherche industrielle. Modèle de compréhension et de pilotage par les situations-type : recherche-action à la direction de la recherche de PSA-Peugeot-Citroën"
"1029","Gilles",2003-01-01,"Catherine",NA,"Les professionnels de l'information européenne à Bruxelles : Sociologie d'un monde de l'information (territoires, carrières, dispositifs)"
"1030","Milad",2008-01-01,"Jean-Jacques",NA,"Les associations de développement local étudiées à travers leurs configurations sociales : le cas d’un village de Haute-Égypte"
"1031","Elisabetta",2008-01-01,"Sonia",NA,"Des problèmes et des remèdes, la désindustrialisation rurale et la précarisation féminine en France et en Italie"
"1032","Fanny",2010-01-01,"Louis",NA,"Contrainte budgétaire du logement, stratification sociale et mode de consommation : étude comparative France et Royaume-Uni (1980-2005)"
"1033","Alexis",2007-01-01,"Michel",NA,"Le football informel d'esplanade : une étude de sociabilité sportive dans la France du début du XXIe siècle"
"1034","Marianne",2002-01-01,"Sylvain",NA,"Figures ouvrières d'aujourd'hui : un enjeu anthropologique et politique, enquêtes auprès des ouvriers de Ford-Aquitaine"
"1035","Sébastien",2007-01-01,"Rémy",NA,"Sociologie du rap français : état des lieux, 2000-2006"
"1036","Mor",2004-01-01,"Monique",NA,"Journalistes de la presse privée écrite et pouvoir politique en Afrique : l'ambiguïté de la relation victimaire"
"1037","Laurent",2003-01-01,"Jean-Michel",NA,"Constitution et traitement d'une population : les jeunes en difficulté d'insertion : l'exemple de deux bassins d'emploi de l'ouest (1975-2000)"
"1038","Rachid",2008-01-01,"Vincent de",NA,"L' expérience du handicap : une quête de sens : pour une sociologie clinique du handicap"
"1039","Hee-Kyung",2009-01-01,"Rémy",NA,"Les arts de la rue en France : 1968-2005 : étude socio-historique"
"1040","Dalila",2000-01-01,"Carmen",NA,"Processus de ségrégation socio-spatiale et vie quotidienne"
"1041","Aurélie",2001-01-01,"Danièle",NA,"Le travail des guichetiers de la Poste : une relation sociale à définir"
"1042","Mame Birame",2007-01-01,"André-Marcel d'",NA,"Représentations socio-économiques et culturelles des migrants seereer à Dakar et création de l'association Ndef Leng : Analyse sociologique et perspectives de développement"
"1043","Ouassa",2000-01-01,"Maxime",NA,"Interventions en milieu rural et perspectives de changement social au Niger : actions et réactions des femmes"
"1044","Jean-Philippe",2006-01-01,"Danièle",NA,"Les paradoxes de la réduction du temps de travail : les effets de l'application des 35 heures sur les salariés de trois secteurs d'activité"
"1045","Pierre",2007-01-01,"Erhard",NA,"Articuler les niveaux territoriaux de l'action publique : la politique de sécurisation du territoire contre les incendies de forêts"
"1046","Karima",2004-01-01,"Jean-Hugues",NA,"Evolution des structures patriarcales en immigration : la famille kabyle en France et au Canada"
"1047","Sabine",2000-01-01,"Eugène",NA,"La theorie du lien social selon nobert elias"
"1048","Muriel",2007-01-01,"Françoise",NA,"L' invention de l'accessibilité : des politiques de transport des personnes handicapées aux politiques d'accessibilité des transports urbains de voyageurs en France de 1975 à 2005"
"1049","Paul",2006-01-01,"Alain",NA,"Le politique dans le particulier : le cas de Recife, Pernambouc, Brésil"
"1050","Anne",2005-01-01,"Philippe",NA,"Les transformations socioprofessionnelles de la maîtrise : l' exemple de la RATP"
"1051","François",2000-01-01,"Raymond",NA,"Les comportements monétaires et financiers : évolution et facteurs de différenciation : contribution à une sociologie de l'argent, des pratiques et des représentations économiques"
"1052","Antoine",2007-01-01,"Claude",NA,"Maximes empiriques de l'activité économique : le marché des fruits et légumes en France (1936-2006)"
"1053","Jean-Philippe",2003-01-01,"Denis",NA,"Homo Pontifex et Pontifex Oppositorum : créativité, imaginaire et heuristique"
"1054","Katia",2002-01-01,"François",NA,"Femmes en armes, une place introuvable ? : le cas de la féminisation de l'armée française"
"1055","Alexandre",2010-01-01,"Numa",NA,"Entre urbanité et communauté, la politisation de l'espace public urbain"
"1056","Magali",2000-01-01,"Alain",NA,"À l'épreuve du sujet : éléments de métasociologie de la recherche"
"1057","Guillaume",2005-01-01,"Anne-Marie","Jean-Claude","La fabrication des salariés vieillissants : pratiques d'entreprises et perspectives d'avenir professionnel"
"1058","Jingyue",2018-03-19,"Florence","Maya","Dynamiques des groupes professionnels et new public management : l’introduction des instruments d’action publique dans la tarification des Établissements d'hébergement pour personnes âgées dépendantes (EHPAD)"
"1059","Matthieu de",2014-01-01,"Philippe",NA,"Enquête sur des enquêtes : les enquêtes de victimation et la connaissance du crime"
"1060","Fayçal",2014-01-01,"Aïssa",NA,"Les formes de la contestation sociale en milieu universitaire en Algérie"
"1061","Roland",2011-02-28,"Jules","Jacques","Impact discursif de la construction de l’Europe sur l’identité syndicale française"
"1062","Abdoulaye Idrissa",2011-01-01,"Pierre-Philippe",NA,"Les étudiants sénégalais en France et aux États-Unis : conditions de vie, conditions d'étude, insertion socio-professionnelle et participation au développement du Sénégal"
"1063","Sylviane",2018-06-30,"Jean-Louis",NA,"Éducation tout au long de la vie et logiques sociales de formation professionnelle : le cas des enseignants spécialisés du premier degré en charge de l’aide pédagogique aux élèves en grande difficulté scolaire"
"1064","Jules",2010-01-01,"Marco",NA,"Analyse comparée de l'expérience de la mobilité sociale ascendante intergénérationnelle aux États-Unis, en France et en Inde"
"1065","Beata Maria",2018-02-22,"Marie","Renata","Monde artistique « transnational » : les trajectoires des musicien-ne-s japonais-e-s dans le monde européen de la musique classique"
"1066","Guillaume",2007-01-01,"Michel",NA,"À l'école de la détention : la socialisation professionnelle des surveillants de prison, trajectoires et expériences dans l'institution carcérale"
"1067","Jean-Pierre",2009-01-01,"Bernard",NA,"Hestia : du mythe au complexe : la pensée du genre dans les cultures méditerranéennes"
"1068","Antonio",2008-01-01,"Michel",NA,"À rebours : motifs du regard et de l'expérience des modes de vie"
"1069","Mariette",2009-01-01,"Bernard","Patrick","Etude comparée du comportement d'achat des boîtes de conserve entre le consommateur libanais et français"
"1070","Erwan",2009-01-01,"Michel",NA,"Porto Alegre, ville imaginaire : socialités, mythes et communication dans un Brésil postmoderne"
"1071","Roberta",2010-01-01,"Dominique","Leticia","La transmission familiale comme clé de lecture du processus de diffusion des innovations : une approche interprétative et microsociale de l'adoption et de la consommation de produits et services de beauté"
"1072","Hélène",2004-01-01,"Régine",NA,"L' autonomie et les éducateurs de foyer : pratiques professionnelles et évolutions du métier en France, en Russie et en Allemagne"
"1073","Jean-Marc",2019-12-16,"Éric de","France","Des hétérotopies incluantes : exploration des usages du tango argentin dans le champ du handicap"
"1074","Julien",2015-11-02,"Bernard","Antoine","L’insécurité personnelle des jeunes dans les transports en commun franciliens : une étude dispositionnelle du sentiment d’insécurité"
"1075","Louise",2019-12-06,"Mirna","Ettore","De l'immigration permanente aux migrations circulaires : l'expérience de la (re)migration dans les trajectoires individuelles en France"
"1076","Carlotta",2018-10-30,"Cédric","Sylvie","Dans les ateliers de la circulation : une ethnographie du travail logistique entre le  Grand Paris et la métropole diffuse vénitienne"
"1077","Marine",2018-12-03,"Mirna","Agnès","Migration DOM-métropole des années 1960 à nos jours : itinéraires d’une minorité française"
"1078","Khedidja",2015-09-22,"Agnès",NA,"L'échange autour du projet urbain : quels savoirs partagés ?"
"1079","Natacha",2008-01-01,"Bruno",NA,"Les sujets du labeur : travail à l'usine, travail de soi et subjectivité des ouvrières et ouvriers des maquilas du Nicaragua"
"1080","Marion",2009-01-01,"Françoise","Jean-Pierre","Apprendre le handicap visuel : la prise en charge de personnes déficientes visuelles par des institutions spécialisées"
"1081","Yong-Hyun",2007-01-01,"Françoise","Anne-Catherine","Pour une sociologie de l'intelligence collective : l'exemple des coordinations gérontologiques"
"1082","Mohamed Toufik",2013-01-01,"Aïssa",NA,"Les enseignants universitaires algériens entre autonomie et instrumentalisation : 1971-1997"
"1083","Teresa",2019-10-16,"Raphaël","Stéphane","Diversité culturelle et égalité : pour une approche dialogique"
"1084","Zheng",2012-01-01,"Rémy",NA,"Les lectures de l'étudiant chinois en France dans l'acquisition de la langue française"
"1085","Sylvain",2006-01-01,"Jacques",NA,"Le droit à l'épreuve du public : une sociologie de l'encadrement de la publicité à la télévision française (1968-2005)"
"1086","Magali",2009-01-01,"Antigone",NA,"Les pratiques culturelles régionales catalanes et le phénomène de résistance culturelle"
"1087","Jean-Christophe",2009-01-01,"Antigone",NA,"Modèles de formation à l'expertise en intervention sociale : perspectives éthiques"
"1088","Elsa",2000-01-01,"François de",NA,"La construction du ""chez soi"" : les étudiants qui cohabitent avec leurs parents"
"1089","Muriel",2001-01-01,"François de",NA,"Approche sociologique de l'anorexie : un travail de soi"
"1090","Fabrice",2008-01-01,"Dominique",NA,"La voiture : un regard socio-anthropologique sur le rapport à l'objet automobile"
"1091","Virginie",2008-01-01,"François de",NA,"Les mères lesbiennes : contribution à une sociologie de la parentalité"
"1092","Stéphanie",2008-01-01,"Dominique",NA,"Les ""altermobilités"" : analyse sociologique d'usages de déplacements alternatifs à la voiture individuelle : des pratiques en émergence ?"
"1093","Kaveh",2011-01-01,"Jan","Claudine","Michel Foucault et la critique de la modernité : vers une sociologie foucaldienne"
"1094","Nasser",2005-01-01,"Dominique","Numa","Anthropologie d'une économie souterraine : le ""bizness"" dans une cité H.L.M., nouvelles figures de la norme et de la déviance économique"
"1095","Jérôme",2005-01-01,"Michel",NA,"La mise en scène du corps social : contribution aux marges complémentaires des sociologies du théâtre et du corps"
